,dataset_id,Related RICs,Language,Topics,Products,Attribution,Story Date Time,Take Date Time,Headline,Story Body,Unique Story Index,PNAC
44,63751,,en,US FED CEN PLCY INT MCE MTG AGN INFL MPLT GVD DBT LEN RTRS JOB POL BACT AMERS ECI PIA GEN,C D E M O T U MTL GRO SOF OIL MNI NAT ELN NAW RINVM,RTRS,01/03/2014 18:30:00,01/03/2014 18:30:00,Fed to weigh further cuts to bond buys amid job gains -Lacker,"The Federal Reserve's December move to begin to wind down its massive bond-buying stimulus was the right call in light of U.S. job market gains, and further cuts to the program are likely in the offing, a top Fed official said on Friday.     I supported this decision because it was consistent with the linkage the (Fed's policy-setting) committee established between the asset purchase program and the outlook for labor market conditions, Jeffrey Lacker, president of the Richmond Fed, said in remarks prepared for delivery to the Maryland Bankers Association. I expect further reductions in the pace of purchases to be under consideration at upcoming meetings.      The Fed decided last month to trim $10 billion from its $85 billion in monthly bond purchases, after unemployment fell to a five-year low of 7 percent.     The U.S. central bank had said it would continue the program, its third round of bond purchases, until it saw substantial improvement in the job market outlook. Fed Chairman Ben Bernanke signaled in December that the program could be fully shuttered by late 2014.      Since the program began in late 2012, we've seen a substantial improvement in a variety of indicators of labor market conditions, including the unemployment rate and the level of employment, Lacker said. So it made sense to initiate the process of bringing the program to a close.     Notably, Lacker did not mention the potential downsides of the program; cumulatively, the Fed's three rounds of bond buying so far have brought the Fed's balance sheet to nearly $4 trillion. In a December speech Lacker voiced concern that a large balance sheet could make an exit from stimulative policy difficult, a comment that was absent in Friday's otherwise largely similar speech.     The outlook for the U.S. economy has brightened in recent weeks with the labor market and factory sector strengthening, and Lacker said the stronger growth could be a harbinger of more gains this year.     But experience with similar growth spurts in the recent past suggests that it is too soon to make that call, he warned, saying that he expects growth in gross domestic product, which grew at a brisk 3.6 percent annual pace in the third quarter, to come in at about 2 percent this year.      He also forecast inflation to rise back toward the Fed's 2 percent goal in the next year or two.    (Writing by Ann Saphir in San Francisco; Editing by Leslie Adler)  ((ann.saphir@thomsonreuters.com)(+1 415 677 2516)(Reuters Messaging: steven.c.johnson.reuters.com@reuters.net))  Keywords: USA FED/LACKER",20140103183000nN9N0AR01W,nN9N0AR01W
45,63756,,en,FED CEN PLCY US MCE DBT INT MPLT INFL MTG LEN RTRS AMERS ECI,M U E NAW NAT D T MNI RINVM J Z PSC RNP DNP PTD,RTRS,01/04/2014 16:54:53,01/04/2014 17:11:09,Fed's Dudley: could decide at 'future date' on repo facility,The head of the Federal Reserve Bank of New York said on Saturday the U.S. central bank could decide at a future date to fully implement a proposed new policy tool known as a fixed-rate full-allotment reverse repo facility.     The facility has been in test mode since September and is set to last until the end of January. The Fed's policy-setting Federal Open Market Committee would have to decide to adopt it formally. [ID:nL2N0JH20N]   (Reporting by Jonathan Spicer and Jason Lange; Editing by James Dalgleish)  ((jonathan.spicer@thomsonreuters.com)(+1 646 223 6253)(Reuters Messaging: jonathan.spicer.thomsonreuters.com@reuters.net  www.twitter.com/jonathanspicer))  Keywords: USA FED/DUDLEY REPO,20140104165453nN9N0A9012,nN9N0A9012
46,63758,,en,COM REAM FRX GVD REAL MET MCE ECI INT EMRG AU DE IN US GB CA EUROP EZC CN EZ EUR ASIA PINV RPOLL BOE BOJ CEN ECB FED APOLL REP DBT FINS BMAT MINE MTAL MIN WEU CEEU AMERS EU LEN RTRS,G C D E M O T U OIL NAT UKI GRO MTL SOF PSC,RTRS,01/03/2014 14:27:47,01/03/2014 14:27:47,TAKE A LOOK-POLL-Reuters Poll stories from around the world,"Reuters produces dozens of polls of professionals every month that provide exclusive insight into economies and markets.          For a speed guide to major Reuters polls click on <POLL1>          For Reuters consensus forecasts on scheduled economic indicators and central bank policy decisions, see Economic Indicator Monitor on Thomson Reuters Eikon or the relevant <ECON> page by country code, e.g., <ECONCN>.  NEWS STORIES ON RECENT REUTERS POLLS > EU deal to close failed banks won't break ""doom loop""  [ECB/INT] > BoE may lower jobless rate guidance, but not this month[BOE/INT] > Fed's taper puts policy on a clear course        [ID:nL3N0JZ2N6] > Steadier gains expected for world stocks in 2014    [EPOLL/WRAP] > U.S. poised for stronger growth in 2014               [ECILT/US] > ECB seen offering more cheap cash for banks           [ECILT/EU] > Japan growth forecasts cut for 2nd month on weak      [ECILT/JP] > Fervent growth for 2014's UK economy                  [ECILT/GB] > Runaway Indian house prices seen slowing         [ID:nL4N0JL1PR] > SNB to leave franc cap in place into 2015 or later     [SNB/INT] > South African economy to gather steam next year       [ECILT/ZA] > Euro recent strength to turn as ECB stays dovish      [EUR/POLL] > More BOJ easing to keep yen weak over next year       [JPY/POLL] > No reprieve for weakening Canadian $ in coming yr     [CAD/POLL] > BoE closer to hike but pound strength short lived     [GBP/POLL] > Russian economy set to disappoint again in 2014  [ID:nL6N0K31JJ] > ECB won't launch QE or reduce reserve requirement      [ECB/INT] > BoE's guidance has kept lid on rising market rates     [BOE/INT] > U.S. home price gains to downshift abruptly           [US/HOMES] > Canadian housing overvalued, crash fears ease         [CA/HOMES] > UK home prices to head higher                         [GB/HOMES] > China home price rises seen slowing to 5 pct in 2014  [CN/HOMES] > Brazil urban home prices seen rising 5-10 percent     [BR/HOMES] > Africa's top oil producers to see robust growth       [ECILT/NG] > Fed's Bernanke scores 8/10 from economists       [ID:nL5N0J537S] > Egypt is worst Arab state for women              [ID:nL5N0IM239]   NEWS STORIES ON MAJOR CENTRAL BANK POLLS > Philippine c.bank seen holding rates through March    [PH/INT] > Bk of Korea to hold rates in Dec, through most of 2014[ID:nL3N0JO1R0]      LONG TERM ECONOMIC SURVEYS > Global wrapup                                     [ECILT/WRAP] > Latam wrapup                                      [ECILT/LTAM] > Asia wrapup                                       [ECILT/ASIA] > United States                                       [ECILT/US] > Euro zone                                           [ECILT/EU] > Britain                                             [ECILT/GB] > Japan                                               [ECILT/JP] > Germany                                             [ECILT/DE] > France                                              [ECILT/FR] > Canada                                              [ECILT/CA] > Italy                                               [ECILT/IT] > Turkey                                              [ECILT/TR] > India                                               [ECILT/IN] > Australia                                           [ECILT/AU] > China                                               [ECILT/CN] > Russia                                              [ECILT/RU] > Gulf wrapup                                       [ECILT/GULF]       LATEST REUTERS FOREIGN EXCHANGE POLLS > Euro recent strength to turn as ECB stays dovish    [EUR/POLL] > More BOJ easing to keep yen weak over next year     [JPY/POLL] > No reprieve for weakening Canadian $ in coming yr   [CAD/POLL] > BoE closer to hike but pound strength short lived   [GBP/POLL] > Swedish, Norwegian crowns may regain lost ground    [SEK/POLL] > South Africa's rand seen firmer in a year           [ZAR/POLL] > CEE currencies seen recovering from falls          [CEEU/POLL] > Weakening Brazil's real to keep c.bank under fire   [BRL/POLL] > Bullish bets on emerging Asia FX trimmed            [ASIA/FXP] > Major currencies poll stories and data           <FOREXPOLL01>      NOVEMBER GLOBAL ASSET ALLOCATION POLL > Investors boost cash as they round off a bumper yr[ASSET/WRAP] > U.S. fund managers increase stock holdings          [US/ASSET] > European funds shun bonds                          [EUR/ASSET] > British investors back stocks into year-end         [GB/ASSET] > Japan fund managers keep stock weighting            [JP/ASSET]               REUTERS POLLS ON MAJOR HOUSING MARKETS > U.S. home price gains to downshift abruptly         [US/HOMES] > Canadian housing overvalued, crash fears ease       [CA/HOMES] > UK home prices to head higher                       [GB/HOMES] > China home price rises seen slowing to 5 pct in 2014[CN/HOMES] > Brazil home prices seen rising 5-10 pct this year   [BR/HOMES] > China home prices seen up 8 pct in 2013             [CN/HOMES] > Runaway Indian house prices seen slowing         [ID:nL4N0JL1PR]  REUTERS POLLS ON MAJOR WORLD COMMODITIES > Smaller cocoa supply deficit expected, outlook shaky[COC/POLL] > Growing supply bears down on 2014 copper prices     [MET/POLL] > Brighter economy to fuel palladium performance     [PREC/POLL] > Gold prices to stay depressed for second year      [GOLD/POLL] > Global sugar surplus estimates nearly double        [SUG/POLL] > Iron ore prices seen at 4-yr low as China slows[ID:nL3N0FB05A]         REUTERS POLL ON MONEY MARKETS AND BOND YIELDS  > Bond poll stories and data by country     [US/INT] <BONDPOLL1> > Data from the poll                                  [BOND/PDF]      MAJOR POLLS > Federal Reserve primary dealers poll                   [FED/R] > European Central Bank interest rate poll             [ECB/INT] > Bank of England interest rate poll                   [BOE/INT] > Swiss National Bank interest rate poll               [SNB/INT] > Bank of Canada interest rate poll                    [CA/POLL] > Reserve Bank of Australia interest rate poll          [AU/INT] > Reserve Bank of India poll                           [RBI/INT] > G7 long term economic outlook poll                [ECILT/WRAP] > Asian economic outlook poll                       [ECILT/ASIA] > Gulf economic outlook poll                        [ECILT/GULF] > Forex polls                                      <FOREXPOLL01> > BRIC currencies poll                               [BRIC/POLL] > Bond yields poll                                      [US/INT] > Asset allocation poll                             [ASSET/WRAP] > Global stock market outlook                       [EPOLL/WRAP] > Brazil housing market poll                          [BR/HOMES] > China housing market poll                           [CN/HOMES] > UK house price poll                                 [GB/HOMES] > U.S. house price poll                               [US/HOMES] > Dubai house price poll                              [AE/HOMES] > Spanish house price poll                            [ES/HOMES] > Australian house price poll                         [AU/HOMES]  REUTERS LONG TERM ECONOMIC POLLS  > G7 polls data (U.S., UK, JP, EU monthly)           <ECONPOLL1> > Asia-Pacific quarterly poll stories and data        <MKTPOLL1> > Latin America quarterly poll stories and data     <LATAMPOLL1>              REUTERS QUARTERLY GLOBAL STOCK MARKETS POLL  > Stock market poll stories and data by country    <EQUITYPOLL1> REUTERS AFRICA ECONOMIC POLLS                      <AFRICAPOLL1> REUTERS CORPORATE EARNINGS POLLS                     [POLL-RESF]       REUTERS COMMODITIES POLLS  > Weekly EIA,API inventory forecast                      [EIA/S] > U.S. natgas inventory forecast                       [EIA/GAS] > Cocoa price forecast poll                           [COC/POLL] > Coffee price forecast poll                          [COF/POLL] > Precious metals price forecast poll                [PREC/POLL] > Base metal price forecast poll                      [MET/POLL] > Grains price forecast poll                          [GRA/POLL] > Oil poll                                              [O/POLL] > Carbon poll                                         [CO2/POLL]      If you have any queries about Reuters polls or would like to participate, please call +44 20 7542 5223 or e-mail polling.unit@thomsonreuters.com          (Reuters Polls)   Keywords: POLL/LOOK",20140103142747nL3N0KD22W,nL3N0KD22W
47,63764,,en,DBT MTG MCE INT PLCY US MPLT INFL CEN FED AMERS ECI LEN RTRS FINS WASH AGN FUND MMT GVD BANK JOB BISV BSVC BACT PIA GEN POL,D T E M NAT NAW U C O MTL GRO SOF OIL MNI ELN RINVM J Z DNP,RTRS,01/04/2014 15:29:55,01/04/2014 15:40:17,Still unclear exactly how QE eases conditions -Fed's Dudley,"Extensive research into massive asset-purchase programs has not yet clarified whether such policies ease financial conditions primarily as a signal to investors or more directly through private portfolios, an influential U.S. central banker said on Saturday.     The Federal Reserve is currently buying $75 billion a month in Treasuries and mortgage bonds in its third round of quantitative easing, or QE3, which is meant to ease longer-term borrowing costs in the economy.      Yet we still don't have well-developed macro-models that incorporate a realistic financial sector,' William Dudley, president of the New York Fed, told an economics conference.     We don't understand fully how large-scale asset purchase programs work to ease financial market conditions, there's still a lot of debate ... he said. Is it the effect of the purchases on the portfolios of private investors, or alternatively is the major channel one of signaling?   (Reporting by Jonathan Spicer and Jason Lange; Editing by James Dalgleish)  ((jonathan.spicer@thomsonreuters.com)(+1 646 223 6253)(Reuters Messaging: jonathan.spicer.thomsonreuters.com@reuters.net  www.twitter.com/jonathanspicer))  Keywords: USA FED/DUDLEY",20140104152955nL2N0KE0AF,nL2N0KE0AF
48,63772,,en,DBT MTG MCE INT PLCY US MPLT INFL CEN FED AMERS ECI LEN RTRS GVD WASH PIA GEN POL,D T E M NAT NAW U PSC RNP DNP PTD,RTRS,01/04/2014 23:15:27,01/04/2014 23:34:11,Fed could trim bond-buying more sharply in future -Plosser,"The Federal Reserve could well consider cutting its bond-buying by more than a $10 billion monthly increment in the future, Philadelphia Fed President Charles Plosser said on Saturday, floating $25 billion as a hypothetical amount.     The U.S. central bank trimmed its quantitative easing program to $75 billion per month, from $85 billion, at a much anticipated policy meeting last month, reducing its extraordinary support for the U.S. economy.     It's good that we did it, Plosser, a hawkish Fed official, told reporters on the sidelines of a conference. But if the economy continues to grow and strengthen I think that there's no reason why we shouldn't want to consider speeding the process up if we can, he said.     I have no problem with gradually unwinding it, but my preference would be to move a little quicker and end it sooner rather than later, Plosser added.        (Reporting by Jonathan Spicer; Editing by Dan Grebler)  ((jonathan.spicer@thomsonreuters.com)(+1 646 223 6253)(Reuters Messaging: jonathan.spicer.thomsonreuters.com@reuters.net  www.twitter.com/jonathanspicer))  Keywords: USA FED/PLOSSER QE",20140104231527nL2N0KE0HN,nL2N0KE0HN
49,63809,KMI.N GS.N,en,BANK REGS FED JUDIC CEN FUND INVB RET BNK FIN US CMPNY BISV MNGISS FINS BSVC INVS CYCS SHOP BACT AMERS GEN CLJ LEN RTRS,E U NAW PSC RNP DNP,RTRS,01/04/2014 02:00:52,01/04/2014 02:00:52,NY Fed moves to dismiss suit brought by former Goldman examiner ,"The New York Federal Reserve Bank filed a motion on Friday to dismiss a lawsuit brought by a former employee who claimed she was fired after refusing to alter a critical examination of Goldman Sachs Group Inc <GS.N>.     The ex-employee, Carmen Segarra, said after examining Goldman's legal and compliance divisions for seven months, she found the bank did not have policies to prevent conflicts of interest as required by regulation.      In a 30-page court document, lawyers for the New York Fed said some of Segarra's claims were implausible owing to numerous contradictions within her pleading.      Most glaringly, the allegation that Goldman Sachs did not  have any conflict of interest policy is belied by plaintiff's own exhibits, which show that the 'nonexistent' policies were, in fact, available on Goldman Sachs's public website, the document said.     Attorneys who filed the motion in federal court in the Southern District of New York and Segarra's lawyer, Linda Stengle, did not immediately respond to a request for comment. A Goldman Sachs spokesperson also did not respond to a request for comment.       According to Segarra's lawsuit, the New York Fed's Legal Compliance and Risk team voted to downgrade Goldman's annual rating pertaining to policies and procedures as a result of  findings. She alleges that two New York Fed officials overseeing the Wall Street bank, Michael Silva and his deputy Michael Koh, were concerned a downgrade would hurt the Goldman's business.     Both Koh and Silva are named as defendants in Segarra's lawsuit, as well as her former supervisor, Johnathon Kim.     Segarra was assigned to Goldman's legal and compliance divisions from October 2011 until May 2012, and looked into three controversial transactions related to Solyndra, Capmark and the merger of El Paso and Kinder Morgan Inc <KMI.N>. At that point, Kim, Silva and Koh fired her and had her escorted from the building by security guards after weeks of disputes and pressure to change her examination findings, the lawsuit said.     The case is Segarra v. The Federal Reserve Bank of New York et al in the U.S District Court for the Southern District Of New York, No. 1:13-cv-07173-RA    (Reporting by Mica Rosenberg; Editing by Lisa Shumaker)  ((mica.rosenberg@thomsonreuters.com)(646-223-6735))  Keywords: NYFED GOLDMAN",20140104020052nL2N0KE00S,nL2N0KE00S
50,63824,,en,DBT MTG GVD MCE ECI INT PLCY JOB US MPLT INFL CEN POL FED BACT AMERS PIA GEN LEN RTRS,C D E M O T U MTL GRO SOF OIL MNI NAT ELN NAW,RTRS,01/04/2014 22:00:00,01/04/2014 22:00:00,Fed's Plosser at odds with policy approach favored by Yellen,"The Great Recession could have done permanent damage to potential U.S. output, a top Federal Reserve official said on Saturday, taking an indirect shot at more cyclical approaches to policy-making that is favored by many economists, including the next Fed chair.     Philadelphia Fed President Charles Plosser said in a speech he is skeptical of so-called optimal control approaches to monetary policy in which mathematical models are used to predict when things like unemployment and economic growth will return to more normal levels.     Fed Vice Chair Janet Yellen, who is set to take the reins at the U.S. central bank next month, has often touted this approach, including tolerating higher inflation for a short time in order to speed up the overall economic recovery.     While Yellen is a dovish backer of the Fed's aggressive stimulus, Plosser - who regains a vote on policy this year under the Fed's rotating system - is among the minority of hawks who oppose policies such as large-scale bond-buying.     Measures that arbitrarily, or by assumption, assign the bulk of fluctuation in GDP to purely temporary factors may provide poor policy guidance when shocks are more permanent in nature, he said in prepared remarks to the Korea-America Economic Association.     To recover from the recession, the U.S. central bank has held interest rates near zero since late 2008 to spur growth and hiring. It has also quadrupled the size of its balance sheet to around $4 trillion through three rounds of bond purchases aimed at holding down longer-term borrowing costs.     While gross domestic product growth rose above 4 percent in the third quarter, it has generally stayed closer to 2 percent since the recession ended in 2009, causing some to think that longer-term potential GDP growth is no longer the 3-percent rate to which Americans are accustomed. [ID:nL2N0IT28U]     If that is the case, the Fed's ultra easy policy stance - including promises to keep rates near zero for a while in order to drive down joblessness - may be misdirected.     The shock that hit the economy appears to have had very persistent, if not permanent, effects, Plosser said. From a statistical perspective, the economy appears to have taken a permanent hit to the output level.     Yellen and current Fed Chairman Ben Bernanke have stressed the economic recovery has a long way to go, and that the Fed is committed to stimulus as long as needed. Yellen, who is expected to win Senate backing for the chairmanship on Monday, first mentioned an optimal control policy path in June, 2012. [ID:nL2N0JB1UO]     Plosser said he is skeptical on optimal control exercises that are derived from specific models and not on a variety of models.     A robust, systematic approach to policy, which is transparent and minimizes the degree to which data mismeasurement and model uncertainty affect policy, is the most promising approach to the uncertainties facing policymakers in real time, he said.        (Reporting by Jonathan Spicer; Editing by Dan Grebler)  ((jonathan.spicer@thomsonreuters.com)(+1 646 223 6253)(Reuters Messaging: jonathan.spicer.thomsonreuters.com@reuters.net))  Keywords: USA FED/PLOSSER",20140104220000nL2N0KE0E4,nL2N0KE0E4
51,63842,,en,PLCY US EUROP ASIA BRV BOE BOJ CEN ECB REP CLM FED MCE AMERS EU LEN RTRS,C D E M O T U OIL NAT UKI GRO MTL SOF G PSC,RTRS,01/06/2014 09:39:27,01/06/2014 09:39:27,BREAKINGVIEWS-Monetary policy similarity outweighs divergence,"It looks like monetary policy is splintering around the world. The Fed will taper, while the ECB may have to add stimulus. Japan and the UK plan to stay where they are. But the variations hide a greater similarity: they are all still trying to push up growth with easy money.          Full view will be published shortly.          <^^^^^^^^^^^^^^^^^^^^^^^^^^^^^^^^^^^^^^^^^^^^^^^^^^^^^^^^^^      SIGN UP FOR BREAKINGVIEWS EMAIL ALERTS:     www.breakingviews.com/TOPNewsSubscription          ^^^^^^^^^^^^^^^^^^^^^^^^^^^^^^^^^^^^^^^^^^^^^^^^^^^^^^^^^^>           (The author is a Reuters Breakingviews columnist. The opinions expressed are his own.)     - For previous columns by the author, Reuters customers can click on [HADAS/]     (Editing by Chris Hughes and Sarah Bailey)     ((edward.hadas@thomsonreuters.com))     ((Reuters messaging: edward.hadas.thomsonreuters.com@reuters.net))       Keywords: BREAKINGVIEWS MONETARY POLICY/",20140106093927nL6N0KG0RQ,nL6N0KG0RQ
52,63845,DECPP=ECI DECPPY=ECI DEHIP=ECI DEHIPY=ECI,en,GVD MCE ECI WEU DE EUROP EZC CEEU INFL BBK CEN ECB DBT EU LEN RTRS,D T E M EMK PSC,RTRS,01/06/2014 09:00:25,01/06/2014 09:00:25,"TABLE-German Hesse Dec CPI +0.4 pct m/m, +1.2 pct y/y","Consumer prices in the German state of Hesse rose in December by 0.4 percent month on month and were up 1.2 percent year on year, the state's statistics office said on Monday.     Annual inflation decelerated to 1.3 percent for the whole of 2013 from 2.0 percent in 2012, the office added.      Preliminary pan-German consumer price data are due at 1200 GMT. The statistics office gave the following breakdown of its  June consumer price data:                                        Percentage change   Index/component                        mth/mth   yr/yr  Index   Overall price index                    +0.4      +1.2   106.0   Foodstuffs and non-alcoholic drinks    +1.2      +2.6   111.4  Alcoholic drinks and tobacco           +0.1      +3.1   109.1  Clothing and shoes                     -3.3      -0.7   103.0  Rents, water, electricity, gas         +0.1      +1.5   107.6 and other fuels     Furniture, household goods and repairs +0.4      +0.4    100.0   Health and personal care items         +0.1      -3.7     99.5  Transport                    +0.3      +0.2    106.3  Communications                     -0.1      -1.2     92.7  Entertainment, leisure                 +2.7      +2.4    106.4   Education                              +0.0      +1.6    100.8   Lodgings and catering                  +0.1      +2.6    108.1  Other goods and services               -0.1      +1.3    103.2   Keywords: GERMANY INFLATION/HESSE",20140106090025nL6N0KG0NF,nL6N0KG0NF
