,dataset_id,Related RICs,Language,Topics,Products,Attribution,Story Date Time,Take Date Time,Headline,Story Body,Unique Story Index,PNAC
117,64052,,en,EU ECB CTXT POL EZ EUR PT CEN NEWS1 TAL IMF MCE BNK PLCY INT GVD DBT BANK FINS AAA GR FR NL IE DE WEU IT ES BISV BSVC EUROP EZC CEEU SEEU PIA GEN LEN RTRS,P GNN UKI G C D E M O T U OIL NAT GRO MTL SOF EMK PSC,RTRS,01/07/2014 12:40:54,01/07/2014 12:40:54,TAKE A LOOK-Ireland's first post-bailout bond attracts strong demand,"    Ireland looked set for a storming return to the international bond market on Tuesday, with bumper demand expected for the country's first debt sale since exiting its EU/IMF bailout last month.                    IRELAND > Bumper demand for 1st Irish bond since bailout    [ID:nL6N0KH0TJ]  > In landmark for EU, Ireland leaves bailout behind [ID:nL6N0JS1XH]  > Ireland to exit bailout without credit line       [ID:nL5N0IZ3BO]  > Dublin eases on austerity as bailout exit beckons [ID:nL6N0I50OG]   > Flush with cash, Ireland cans debt sales til 2014 [ID:nL6N0HR1ZW]   > Moody's nudges Ireland closer to investment grade [ID:nL2N0HG214]  > Ireland hails historic debt deal with ECB         [ID:nL5N0B73MS] > Ireland raises 2.5 bln euros to near bailout exit [ID:nL5E9C84YL] ---  EURO ZONE > Euro zone - reasons to be wary in 2014            [ID:nL6N0K9244]  > Draghi backs EU bank plan, critics raise concerns [ID:nL6N0JY47X]  > Europe agrees blueprint for failing lenders       [ID:nL6N0JX4QP]    > German SPD vote to join Merkel despite misgivings [ID:nL6N0JT09S]  > Slovenia says to save banks alone, relief for EU  [ID:nL6N0JR2L0]  > Draghi says ECB ready to act, but unsure how      [ID:nL5N0JK4C5] > Reluctant Germany casts cloud over EU bank revamp [ID:nL5N0J02MK]  > France stalls, euro recovery comes to near halt   [ID:nL5N0IX45D]   > EU starts investigating German c/a surplus        [ID:nL5N0IY2IJ]   > S&P lowers France credit rating to AA from AA+    [ID:nL5N0IT0I1] > ECB, on new mission, sets out bank tests plan     [ID:nL5N0IC3LM] > FACTBOX-Details of health check of eurozone banks [ID:nL5N0ID10M]       > Merkel mandate won't spur leap forward on Europe  [ID:nL5N0HJ1HA]  > EU lawyers say transaction tax plan is illegal    [ID:nL5N0H61J3] ---  ITALY > Italy easily clears last debt sale of 2013        [ID:nL6N0K91KK] > Poverty in Italy hits record levels               [ID:nL6N0K92SJ]   > Italy's Letta wins confidence votes, vows reforms [ID:nL6N0JQ1LH]   > Italy shows recovery signs, France disappoints    [ID:nL6N0JP22V]   > New centre-left leader says must make govt work   [ID:nL6N0JO37U]  > Italy top court rules electoral law out of order  [ID:nL5N0JJ4H6] > Berlusconi breaks from govt after party splits    [ID:nL5N0J106N] > Italian retail bond sale sets European record     [ID:nL5N0IR36P]  > Italy presents 2014 budget with tax,spending cuts [ID:nL6N0I53IU]  > Tasks for Italy's Letta after beating Berlusconi  [ID:nL6N0I01ID]   > Italy banks may tap investors, state for capital  [ID:nL6N0G92KV]  ---  PORTUGAL > Portugal to stay austerity course after court     [ID:nL6N0JZ2XT]   > Lisbon passes bailout review, to meet 2013 target [ID:nL6N0JV3O9] > Portugal swaps bonds to ease post-bailout dues    [ID:nL5N0JI2HR] > INTERVIEW-Portugal new bond likely early 2014     [ID:nL5N0JH2AP] > IMF gives Portugal next tranche, warns of risks   [ID:nL2N0IT27F]   > Portugal to cut state wages in 2014, exit bailout [ID:nL6N0I53Q9]   > Portugal wants to end bailout, may seek new loan  [ID:nL5N0HC1YN]   > Portugal seeks to ease 2014 deficit goal          [ID:nL5N0H71DU] ---  GREECE/CYPRUS > Fragile Greek coalition's majority shrinks        [ID:nL6N0K0088]  > Greece, Troika at odds over layoffs,home seizures [ID:nL6N0JP1SA]   > EU-IMF postpone visit in dispute over reforms     [ID:nL5N0JE2NW] > Moody's raises Greek rating to 'Caa3'             [ID:nL5N0JE3WE] > Greece sees higher surplus, at odds with lenders  [ID:nL5N0J620E] > ECB rejects Athens' bid to roll over Greek bonds  [ID:nL6N0I40CS]  > Greek budget sees end to 6-yr recession next year [ID:nL6N0HX1F0] > Greece mulls swapping loans with 50-yr bond issue [ID:nL6N0HV0IN]  > Greece seals 1st big privatisation since bailout  [ID:nL6N0I121L]  > Cyprus on track with bailout reforms, EU says     [ID:nL6N0GY1J8]   ---  SPAIN > Spain ends 2013 bond programme with strong sale   [ID:nL6N0JY1OA]   > S&P removes Dutch from triple-A club, lifts Spain [ID:nL4N0JE1AX]  > Spain to exit bank aid without additional funds   [ID:nL5N0IZ5VI]   > Fitch raises Spain's outlook on deficit progress  [ID:nL1N0IM161]  > Spanish banks to get 28 bln euros boost - sources [ID:nL5N0IK26G] > Fragile Spanish economy limps out of recession    [ID:nL5N0IK1F5]  > Spanish banks fear new capital hit in EU review   [ID:nL6N0HZ3ON]   > Spain moves forward with tough pension reform     [ID:nL5N0HD363]   > Spain steals a march over Italy on debt           [ID:nL6N0GL1PW] > Spain's Rajoy balks at making deeper reforms      [ID:nL6N0DH4HJ]  ---  GRAPHICS  > Euro zone struggles with debt        http://r.reuters.com/hyb65p > ECB in graphics (package)         http://link.reuters.com/neg32s > Spanish & Italian bond spreads    http://link.reuters.com/vur47s   ((email: mike.peacock@thomsonreuters.com)(Reuters Messaging:)(mike.peacock.reuters.com@reuters.net: +44 207 542 3784))  Keywords: ECONOMY EUROPE/DEBT",20140107124054nL5N0IT0QU,nL5N0IT0QU
118,64061,,en,MMT MCE US FED FRX GVD INT PLCY JOB MPLT INFL CEN WASH POL FBOX DBT BACT AMERS ECI CTXT PIA GEN LEN RTRS,C D E M O T U MTL GRO SOF OIL MNI NAT ELN NAW G J RINVM Z PSC,RTRS,01/06/2014 23:20:21,01/06/2014 23:20:21,FACTBOX-The ins and outs of Yellen's 'optimal control' policy path ,"Janet Yellen owes part of her dovish reputation to her embrace of an optimal control policy approach that tolerates inflation temporarily overshooting the Federal Reserve's 2 percent goal in return for a quicker decline in U.S. unemployment.     Investors are likely to weigh more carefully what such an approach might mean for U.S. monetary policy after she was  confirmed by the Senate on Monday to succeed Ben Bernanke at the helm of the central bank.     Economists at Goldman Sachs think optimal control considerations mean the central bank is likely to hold off raising interest rates for longer than many financial market participants expect.     Might a Yellen Fed raise interest rates too slowly and allow inflation to get out of control? Or is the bigger risk that it tightens policy prematurely and inflicts another recession?     Optimal policy -- a technical term economists use to describe maximizing good outcomes -- will help frame that debate.                  WHAT IS IT?     Yellen first talked publicly about an optimal control path for rates in a June 2012 speech. But the idea of a mathematical model to summarize policy trade-offs -- in this case between unemployment and inflation -- is common to economics.      It describes a way to set policy that optimizes economic outcomes according to the Fed's dual mandate for price stability and maximum sustainable employment.     As described by Yellen, the Fed could achieve a faster reduction in U.S. unemployment at the modest price of a bit more temporary inflation than it would get if it set policy with rigid respect for its 2 percent inflation goal.     I assume that monetary policy aims to minimize the deviations of inflation from 2 percent and the deviations of the unemployment rate from 6 percent, with equal weight on both objectives, she said in November 2012. At the time, 6 percent was the upper edge of the range of jobless rates that the Fed felt was in keeping with full employment.     When she ran the numbers for that speech, the model suggested the Fed should hold rates near zero until early 2016, and keep them lower than recommended by a more traditional policy rule until 2018.      The payoff would be unemployment falling to 6.5 percent by mid-2015, versus 7 percent under what was then the Fed's baseline forecast, and 7.5 percent if the Fed followed the more traditional rule that recommended earlier rate hikes.          WHAT CRITICS SAY     Skeptics say the optimal control approach may optimize economic outcomes, but it lacks control and increases the risk of a policy error.     The optimal control framework actually provides the illusion of control without necessarily control itself, said Carl Tannenbaum, chief economist for Northern Trust in Chicago.     By tolerating higher inflation to achieve its employment goal, critics worry the Fed might not realize it has a problem until it is too late.     Further, they worry that the inflation and unemployment goals are too loosely defined to keep the central bank on the straight and narrow. The Fed targets 2 percent inflation, but shoots for that goal over the medium term.      As for the jobless rate it tries to achieve, officials now say it is likely between 5.2 percent and 5.8 percent, but they don't know for sure and admit it could change over time.     You might end up with the Fed probably being able to justify a broad range of actions on the basis of the same set of data, said Tannenbaum. It may seem more scientific than it actually is.                    SUPPORTERS' VIEW     Economists who think Yellen is on the right track prefer to think about the optimal control approach as a common sense way to describe a problem faced by the Fed when inflation is lower than desired, as is currently the case.     Optimal control is just language for pointing out that in that case, it is a much clearer policy choice, if you think inflation at the moment is too low and ... unemployment is too high, said James Hamilton, an economics professor at the University of California, San Diego.     Also, the risk of a policy mistake cuts both ways, and a decision to tighten policy too soon might mean hundreds of thousands, if not millions, of Americans being without work for longer than would have otherwise been the case.     You have to acknowledge that may be having a permanent effect on people's lives, and for that matter a permanent effect on what we can accomplish as a nation, Hamilton said.          WHAT IS THE FED DOING NOW?     Yellen has said the model is instructive and a useful guidepost, but that it's no replacement for judgment. She has said she would never advocate turning over monetary policy to a computer.     The Fed, however, has taken steps that are very much in keeping with the spirit behind an optimal control approach.      To convince financial markets they will keep rates low for a long time, officials had said they would not raise rates at least until unemployment hit 6.5 percent, provided the outlook for inflation stayed under 2.5 percent.      On Dec. 18 the Fed tweaked that pledge, saying it likely would be appropriate to keep rates near zero well past the time that the jobless rate fell below 6.5 percent, especially if inflation expectations remained below target.     The U.S. jobless rate in November was 7.0 percent.   (Reporting by Washington economics team; Editing by Paul Simao and Chizu Nomiyama)  ((+1-202-898-8329))  Keywords: USA FED/YELLEN POLICY",20140106232021nL2N0K20ME,nL2N0K20ME
119,64057,EUHICF=ECI EUPPI=ECI,en,ECB EU CMPNY NEWS1 CEN CPROD MCE ECI INDS INDG RET PLCY EZ EUR INFL EUROP EZC WEU REP CYCS SHOP BACT LEN RTRS,NW SW DA FN NBN C D E M O T U OIL NAT UKI GRO MTL SOF G EMK PSC RNP PGE,RTRS,01/07/2014 11:07:23,01/07/2014 11:07:23,UPDATE 1-Surprise drop in euro zone inflation shows deflation risk,"Euro zone inflation fell in December after a small increase the previous month, increasing the European Central Bank's challenge of avoiding deflation as well as supporting the bloc's recovery.     Consumer price inflation in the 17 countries then sharing the euro stood at 0.8 percent year-on-year in the last month of 2013, compared with 0.9 percent in November, data from the EU's statistics office Eurostat showed on Tuesday.      December's reading takes inflation back to near a four-year-low of 0.7 percent in October.      Today's figures show that it's too early for the ECB to become complacent about deflation risks, especially in peripheral countries, said Peter Vanden Houte, ING's chief euro zone economist, referring to the bloc's weaker members.     An inflation rate that is well below the ECB's target of close-to-but-below 2 percent carries risks in the longer term because it can deflate wages and demand, depressing the economy.     Reacting to the data, the euro rose to $1.3646 from $1.3618 on speculation the ECB could consider more steps to support the economy.[ID:nL6N0KH11U]     The October drop in inflation was the first fall below 1 percent since February 2010 and prompted the European Central Bank to cut its key interest rate to a new record low of 0.25 percent in November.     Still, the euro zone is far from the deflation that Japan suffered from the early 1990s.     ECB President Mario Draghi said last week there were no signs of deflation or an urgent need for another rate cut, but added that it was vital to avoid a scenario where inflation gets stuck permanently below one percent and slips into a danger zone for the economy.     While we believe that for the time being the ECB will keep its monetary policy unchanged, not much is needed to push the central bank into action, said Vanden Houte.     Analysts see the ECB staying on hold at its rate-setting meeting on Thursday, while watching out for any action the bank may take in reaction to current low inflation environment.     We believe the ECB will most likely enact its Long-Term Refinancing Operation (LTRO) in the next few months, which may very well be tailored specifically towards bank lending, said IHS chief European economist Howard Archer.      ECB Governing Council members have signalled the bank will provide more money to banks by the time the cheap long-term loans it has already made expire. The ECB injected more than 1 trillion euros into the banking system via three-year loans in December 2011 and February 2012, which means the first tranche of repayments is due in late 2014.     Eurostat's separate data release showed euro zone industrial producer prices eased their decline in November to fall by 0.1 percent on the month after a 0.5 percent drop in October, putting the annual rate at -1.2 percent, compared with a nearly four-year low of -1.3 percent seen in October.     The monthly drop was led by a 0.2 percent fall in costs of intermediate goods while prices of capital, durable, non-durable goods and energy prices were flat compared with October.     Changes in producer prices, unless absorbed by retailers, eventually translate into changes in the consumer price index.     Eurostat's detailed inflation data breakdown for December, country by country, will be published on Jan. 16.          ^^^^^^^^^^^^^^^^^^^^^^^^^^^^^^^^^^^^^^^^^^^^^^^^^^^^^^^^^^^^^ For a TABLE on Dec inflation see:             [ID:nB5E8KL02F] For a TABLE on Nov producer prices see:          [ID:nB5E8KL02E] For more details: http://epp.eurostat.ec.europa.eu/portal/page/portal/eurostat/home For a GRAPHIC see:             http://link.reuters.com/kuj24s ^^^^^^^^^^^^^^^^^^^^^^^^^^^^^^^^^^^^^^^^^^^^^^^^^^^^^^^^^^^^^   (Editing by Jeremy Gaunt)  ((martin.santa@thomsonreuters.com)(+32 2 287 6854)(Reuters Messaging: martin.santa.reuters.com@reuters.net))  Keywords: EUROZONE ECONOMY/",20140107110723nL6N0KH15J,nL6N0KH15J
120,64046,PLC Group Ocado OCDO.L,en,LATAM ASIA MEAST EUROP EEU DIARY EU G7 G8 CEN ECB DBT IMF PREV WEU REP CMPNY GB APL RET ITSE RFOD NCYC FDRT TECH SWIT HSGD CYCS CYCP CELE SHOP AMERS LEN RTRS,C D E M O T U OIL NAT UKI GRO MTL SOF DIA EMK PSC RNP DNP PCO,RTRS,01/07/2014 10:23:55,01/07/2014 10:23:55,"DIARY - Key World Financial Events to Feb 19, 2014","    For the World Elections diary double click on  [VOTE/DIARY].     For the Reuters Polling Unit Diary click on    [POLL/DIARY]     For an index of diaries, double-click on       [IND/DIARY].     For further U.S. Federal Reserve Events double-click on                                                    [FED/DIARY]     G7 real-time economic data                      <ECON>     FOR the Global General and Political Diary see [POL/DIARY]       Please note the diaries mentioned above can be accessed only from Thomson Reuters products.       Note - New events marked with **       REUTERS KEY WORLD FINANCIAL EVENTS CALENDAR    ECONOMIC EVENTS     JAN 07  ** HARTFORD - Federal Reserve Bank of Boston President Eric Rosengren speaks before the Connecticut Business & Industry Association ""Economic Summit & Outlook 2014"" - 1330 GMT.     ** PHOENIX, United States - Federal Reserve Bank of San Francisco President John Williams speaks on the economy and monetary policy before a luncheon hosted by the Lambda Alpha International Phoenix Chapter and the Arizona Bankers Association - 1910 GMT.             JAN 08  ** WASHINGTON - Federal Open Market Committee (FOMC) releases the Minutes of December meeting - 1900 GMT.     LONDON - Bank of England (BoE) holds Monetary Policy Committee (MPC) meeting (to Jan 09).              JAN 09  MINNEAPOLIS, United States - Federal Reserve Bank of Minneapolis President Narayana Kocherlakota participates in ""Public Town Hall Forum with President Kocherlakota"" hosted by the Federal Reserve Bank of Minneapolis - 0100 GMT.      LONDON - Bank of England (BoE) announces interest rate decision.  ** MADISON, United States - Federal Reserve Bank of Kansas City President Esther George speaks on ""Banking and the U.S. Economy"" before the Wisconsin Bankers Association - 1830 GMT.     FRANKFURT - ECB Governing Council meeting followed by interest rate announcement and News conference.       JAN 10  ** INDIANAPOLIS, United States - Federal Reserve Bank of St. Louis President James Bullard gives presentation on the U.S. economy and monetary policy before the Indiana Economic Outlook Forum hosted by the Indiana Bankers Association - 1805 GMT.          JAN 13   ATLANTA - Federal Reserve Bank of Atlanta President Dennis Lockhart speaks on the economic outlook before the Rotary Club of Atlanta - 1740 GMT.        JAN 14  ** PHILADELPHIA, United States - Federal Reserve Bank of Philadelphia President Charles Plosser speaks on the economic outlook before the The 13th Annual Economic Outlook presented by The School of Business at LaSalle University - 1745 GMT.   ** CHICAGO - Dallas Federal Reserve President Richard Fisher, a policy hawk who has never shied from dissenting on Fed decisions, gives his outlook for the U.S. economy at a luncheon in Dallas - 1800 GMT.   ** VIENNA - Central & Eastern European Forum 2014 (to Jan 15).        JAN 15  ** CHICAGO - Chicago Federal Reserve President Charles Evans speaks at an Economist Forecast Luncheon - 1730 GMT.    ATLANTA - Federal Reserve Bank of Atlanta President Dennis Lockhart speaks on the economy and monetary policy before the CFA Society of Atlanta - 2220 GMT.      FRANKFURT - 4th Deutsche Bundesbank-OMFIF Economists Meeting chaired by Deutsche Bundesbank Executive Board Member Joachim Nagel.             JAN 16  ** WASHINGTON - Federal Reserve Bank of San Francisco President John Williams presents paper, ""Monetary Policy at the Zero Lower Bound: Putting Theory into Practice"" before a panel on ""Quantitative Easing and Forward Guidance"" before the Brookings Institution - 1415 GMT.              JAN 21  TOKYO - Bank of Japan Monetary Policy Meeting (to Jan 22).               JAN 22  FRANKFURT - ECB Governing Council meeting. No interest rate announcements scheduled.  OTTAWA - Bank of Canada key policy interest rate announcement and Monetary Policy Report.       JAN 28   ** WASHINGTON - U.S. Federal Reserve's Federal Open Market Committee (FOMC) holds two-day meeting on interest rates.        JAN 29  ** WASHINGTON - U.S. Federal Reserve's Federal Open Market Committee (FOMC) announces decision on interest rates.                          JAN 30   WELLINGTON - Reserve Bank of New Zealand announces Official Cash Rate (OCR).       FEB 04  SYDNEY - Reserve Bank of Australia (RBA) holds interest rate meeting.              FEB 05  ** NEW YORK, United States - Federal Reserve Bank of Philadelphia President Charles Plosser speaks on the economic outlook before the 35th Annual Economic Seminar sponsored by the Simon Business School with JP Morgan Chase & Co., Rochester Business Alliance, and the CFA Society of Rochester - 1730 GMT.     LONDON - Bank of England (BoE) holds Monetary Policy Committee (MPC) meeting (to Feb. 06).             FEB 06   HELSINKI - Bank of Finland hosts a meeting on ""Finland's economy at present and prospects for the future"" chaired by Deputy Governor of Bank of Finland Pentti Hakkarainen.        FRANKFURT - ECB Governing Council meeting, followed by interest rate announcement and News conference.  LONDON - Bank of England (BoE) announces interest rate decision.        FEB 07  LONDON - Bank of Greece Governor George Provopoulos delivers a Golden Series lecture on ""The Greek financial crisis: From Exit to Recovery"" in United Kingdom.        FEB 12  ** STOCKHOLM - Swedish Central Bank holds monetary policy meeting (to Jan. 13).  ** REYKJAVIK - Iceland Central Bank announces Interest Rate Decision.   FEB 13  ** STOCKHOLM - Swedish Central Bank announces interest rate decision.     FEB 17  TOKYO - Bank of Japan Monetary Policy Meeting (to Feb 18).              FEB 19   FRANKFURT - ECB Governing Council meeting. No interest rate announcements scheduled.  NEW YORK - Federal Reserve Bank of San Francisco President John Williams speaks before the Money Marketeers of New York University.     -----------------------------------------------------------       RT users double-click on [IND/DIARY] for an index of all      available di aries.        Enquiries to Customer Help Desks -- double-click on      <PHONE/HELP> for telephone numbers.        If you have any questions or comments on the diary, please    contact: E-mail: diaries@thomsonreuters.com         NOTE: The inclusion of diary items does not necessarily  mean that Reuters will file a story based on the event.    Keywords: DIARY KEY WORLD FINANCIAL EVENTS",20140107102355nL3N0KH2JQ,nL3N0KH2JQ
121,64080,,en,MMT MCE MNGISS WEU DE EUROP BBK CEN ECB BANK PLCY REGS EZ EUR EU FINS BISV BSVC BACT EZC CEEU LEN RTRS,M T D EMK,RTRS,01/07/2014 17:22:54,01/07/2014 17:22:54,Lautenschlaeger gets closer to joining ECB Executive board,"Sabine Lautenschlaeger, vice president of Germany's Bundesbank, moved closer to winning a seat on the European Central Bank's six-member executive board on Tuesday after getting the green light from the Council of the European Union.     Lautenschlaeger, an expert in banking supervision, is the only candidate running to succeed Joerg Asmussen, who left the ECB two years into his eight-year term to rejoin the German government as state secretary in the labour ministry.     After finance ministers from the 28 European Union member states adopted the recommendation on her nomination on Tuesday, Lautenschlaeger will need to convince the EU parliament in a hearing on Monday and get approval from the ECB.     The ECB governing council is due to discuss the matter at its monthly policy meeting on Thursday.     The European Council of EU leaders will then take the final decision.        Link to the Council of the European Union's statement: http://www.consilium.europa.eu/uedocs/cms_data/docs/pressdata/en/ecofin/140298.pdf        (Reporting by Eva Taylor and Sakari Suoninen; Editing by Tom Heneghan)  ((eva.taylor@thomsonreuters.com)(49 69 75651244)(Reuters Messaging: eva.taylor.thomsonreuters.com@reuters.net))  Keywords:  ECB/LAUTENSCHLAEGER",20140107172254nL6N0KH2MK,nL6N0KH2MK
