,dataset_id,Related RICs,Language,Topics,Products,Attribution,Story Date Time,Take Date Time,Headline,Story Body,Unique Story Index,PNAC
79,63901,,en,DBT GVD USC FIN INT US BRV CEN REP CLM CMPNY INVB REGS HYD FED GFIN FUND CORPD WEU MMT BANK GB CDM FINS BISV BSVC INVS MCE BACT EUROP AMERS PIA GEN POL LEN RTRS,D T E M NAT RINVM U NAW EMK PSC,RTRS,01/06/2014 15:32:21,01/06/2014 15:32:21,BREAKINGVIEWS-Bondholders may be forced to fix liquidity crisis,"Scarce liquidity could be catastrophic for bondholders - and it may be up to them to do something about it. As their appetite for owning, buying and selling debt grows, that of Wall Street banks is shrinking.     Buying and selling bonds has never been as easy as it is for equities. But in the 2004 to 2007 boom, the liquidity gap closed somewhat. Investment banks more than doubled the dollar amount of corporate bonds they held on their balance sheets to $230 billion, according to New York Federal Reserve statistics. Bank of England data show corporate bond liquidity premiums were persistently below the historical average for most of 2003-2007.     That proved an anomaly. Banks' ensuing losses and new regulations from leverage ratio restrictions to the Volcker Rule obliterated that business model. By the end of March 2013, inventory had plummeted by three-quarters to just $56 billion, around 2002 levels. Yet assets held in high-grade and high-yield corporate bond mutual funds and exchange-traded funds have almost tripled over the past six years to $1.1 trillion, according to T. Rowe Price.     Wall Street firms say they are making up for lost balance-sheet capacity by turning over trading books more quickly. But that helps bondholders little, according to data from bond trading statistics provider Trace, cited in research by T. Rowe Price. Investment-grade block trades bigger than $5 million comprised 5 percent of the market before 2007; now it's less than 0.5 percent. Trades of $1 million or more have slipped to 2 percent from 20 percent.     Less liquidity means worse prices and a greater probability that herd-like investors sell at the first whiff of a crisis. That could come soon if the U.S. Federal Reserve starts dialling back its bond-buying program. The fact that many funds allow investors to withdraw cash at short notice means the market could be vulnerable if investors sell bonds en masse.     Bondholders can help themselves, by supporting nascent e-trading platforms - and not just ones that rely on combining a few brokers. The more comfortable investors get with putting their own data on such trading venues, the more overall liquidity should increase. And they could develop funds with longer liabilities to ease redemption pressures. If they sit on the sidelines, though, they will have to accept being stuck with bonds they no longer want.               <^^^^^^^^^^^^^^^^^^^^^^^^^^^^^^^^^^^^^^^^^^^^^^^^^^^^^^^^^      SIGN UP FOR BREAKINGVIEWS EMAIL ALERTS: www.breakingviews.com/TOPNewsSubscription             ^^^^^^^^^^^^^^^^^^^^^^^^^^^^^^^^^^^^^^^^^^^^^^^^^^^^^^^^^>            - For previous columns, Reuters customers can click on [UNMACK/] and [CURRIE/]    (Editing by Antony Currie, John Foley and Martin Langfield)  ((neil.unmack@thomsonreuters.com)(antony.currie@thomsonreuters. com)(Reuters messaging)(neil.unmack.thomsonreuters.com@reuters.net)(antony.cu rrie.thomsonreuters.com@reuters.net))  Keywords: BREAKINGVIEWS BONDS/LIQUIDITY",20140106153221nL2N0KC0F3,nL2N0KC0F3
80,63858,,en,STX REAM FRX GVD FINS BANK REGS ISU RU DE GR IE UA SQ GB TR EZC EZ EUR PMI NEWS1 BOE DIP ECB CLM TRD FED G8 GFIN DBT BISV MCE ECI INT PLCY JOB WEU ES IT FR US SEEU CEN IMF POL EU BSVC BACT MEVN EUROP EMRG CISC CEEU ASIA AMERS EEU MEAST PIA GEN LEN RTRS,C D E M O T U OIL NAT UKI GRO MTL SOF G EMK PSC,RTRS,01/06/2014 07:48:00,01/06/2014 07:48:00,MORNING BID: EUROPE-A daily note from our Economics/Politics Editor,"Euro zone service sector PMIs and German inflation (with the euro zone number to follow on Tuesday) will lay the ground for the European Central Bank's first policy meeting of the year.     The surveys are likely to show the currency bloc ended the year on a reasonably robust note with Germany leading the way as always, Italy and Spain showing signs of life and France looking worryingly weak.     Ireland's reading is already out and has posted its fastest services growth in seven years. Much more importantly for the world, growth in China's services industries slowed in December, confirming that the world's second-largest economy lost steam at the end of last year.     German inflation on the EU-compatible HICP measure is forecast to have fallen to 1.4 percent year-on-year in December, from 1.6 in November, not the sort of move the ECB will like to see. We've already seen Italian and Spanish inflation come in at just 0.6 and 0.3 percent respectively.     A shock fall in euro zone inflation to 0.7 percent prompted an interest rate cut to 0.25 percent in November (not much scope to lower from there) followed by a chorus of denials that deflation was a threat.     ECB chief Mario Draghi adhered to that last week but added that he and his colleagues had to make sure inflation didn't get stuck in the danger zone below one percent.     By happy or unhappy coincidence, the latest inflation euro inflation data are due on Tuesday, two days before the ECB meets, and are forecast to show the rate unchanged at 0.9 percent.     It's too early for any dramatic moves but the ECB may well be pushed into easing policy if inflation refuses to pick up and/or the banks clam up ahead of this year's health tests.     We pretty much know the state of play within the ECB. With rates already close to zero, there will be no rush to cut them again, another gush of long-term cheap money for the banks is possible, particularly if the looming bank health tests cause them to tighten up further, but too many of its policymakers are viscerally opposed to printing money for that to become an option unless deflation seriously took hold.      U.S. Treasury Secretary Jack Lew will visit Berlin, Paris and Lisbon in the early part of the week. The agenda is not yet clear but the last time Lew was in Europe he was indirectly critical of Germany, stressing the need for Europe to boost domestic demand.     He also described banking union as crucial for the long-term stability of the euro zone. So his  views on whether the piecemeal agreement clinched in December is satisfactory to Washington is a key issue.     IMF chief Christine Lagarde is speaking in Kenya.     Britain's services PMI has reflected the strong growth (albeit from a low base) seen over the past six months. But finance minister George Osborne will don the hair shirt again today, saying that the job of fixing Britain's still wide budget deficit is far from done.     With one eye on next year's election he will say the way to cut taxes permanently is to cut spending permanently. The election timetable is starting to impose itself. Prime Minister David Cameron pledged on Sunday to protect pensioners' incomes, saying the state payment would rise annually by the rate of inflation, average wage increases or 2.5 percent, whichever was the higher.     Peace talks between South Sudan's government and rebels have barely got off the ground and the fighting continues. Three weeks of violence has killed more than a thousand people, forced a cut in oil output and left the world's newest state on the brink of civil war. Western powers are pressing for a deal. Sudanese President Bashir is due in Juba for talks with the south's President Kiir.     Turkish markets have settled after taking a hammering due to a wide-ranging corruption investigation which has led to the resignation of three members of the cabinet and highlighted concern about the independence of the judiciary.     Prime Minister Tayyip Erdogan may have offered something of an olive branch, saying he would not oppose the retrial of hundreds of military officers convicted on coup plot charges. Turkey's appeals court in October upheld the convictions of top retired officers for leading a plot to overthrow Erdogan's government a decade ago.     Erdogan is flying to Japan to start an Asia tour which will also take in Singapore and Malaysia.   (Editing by Jeremy Gaunt)  ((email: mike.peacock@thomsonreuters.com)(Reuters Messaging:)(mike.peacock.thomsonreuters.com@reuters.net: +44 207 542 3784))  Keywords: EUROPE/VIEW",20140106074800nL6N0KG0EN,nL6N0KG0EN
81,63895,,en,FED POL PREV US DIARY MCE DBT GVD CEN GEN WASH AMERS PIA LEN RTRS,D T NAT DIA M,RTRS,01/06/2014 18:50:06,01/06/2014 18:50:06,DIARY-U.S. Treasuries,"    ALL TIMES EST/GMT:                  FEDERAL RESERVE:     For all coming Fed events, please click: [FED/DIARY]          ECONOMIC INDICATORS:     For all scheduled U.S. economic indicators, please click: <ECONUS>          TREASURY:     For the full calendar of scheduled U.S. Treasury securities issuance, please click:     http://www.treasury.gov/resource-center/data-chart-center/quarterly-refunding/Documents/auctions.pdf     or:     http://www.treasurydirect.gov/instit/annceresult/press/press_secannpr.htm          For more economic events, please click: [M/DIARY]   ((U.S. Treasury Desk, +1-646-223-6300))  Keywords: DIARY USTREASURIES/",20140106185006nL2N0KG1E2,nL2N0KG1E2
82,63909,,en,PLCY US CEN WASH POL FED MCE AMERS PIA GEN LEN RTRS,C D E M O T U MTL GRO SOF OIL MNI NAT ELN NAW CAN G J UKI EMK Z PSC RNP DNP,RTRS,01/06/2014 22:58:01,01/06/2014 23:01:02,Majority of U.S. Senate backs Yellen for top Fed job,"Janet Yellen's nomination to be the next chair of the Federal Reserve appeared certain to win approval in the U.S. Senate on Monday as a majority of the chamber voted in her favor.     The roll call vote on the nomination, however, was continuing.   (Reporting by Thomas Ferraro and Richard Cowan)  ((Richard.Cowan@thomsonreuters.com)(Reuters Messaging: richard.cowan@thomsonreuters.com)(+1-202-898-8391)(Reuters Messaging)(richard.cowan.reuters.com@reuters.net))  Keywords: USA FED/YELLEN MAJORITY",20140106225801nL2N0KG1WO,nL2N0KG1WO
83,63888,,en,DBT FINS JOB REGS IT GR EUROP EZC EZ EUR NEWS1 ANV VOTE ECB POL GVD BANK WEU DE FR GB CEN EU BISV BSVC BACT CEEU SEEU PIA GEN LEN RTRS,C D E M O T U OIL NAT UKI GRO MTL SOF G Z EMK PSC,RTRS,01/06/2014 06:05:00,01/06/2014 06:05:00,ANALYSIS-Euro zone - reasons to be wary in 2014,"Last year was the least tumultuous for the euro zone since Greece revealed a vast hole in its books back in 2009.     The consensus is that 2014 will be just as calm - a view held by some who were predicting the currency bloc's demise little more than a year ago.     The political will to keep the show on the road has held firm, the European Central Bank's pledge to underpin the euro continues to stave off bond market pressure and there is the prospect of economies growing at least a little.     Spain, Italy and Portugal are all emerging from recession  and Greece should follow suit this year.     Yet there are plenty of reasons to be cautious.          EU ELECTIONS     High unemployment, austerity fatigue and still anaemic growth offer the perfect backdrop for fringe parties to prosper at May's European parliamentary elections.     Some pundits predict a group of anti-euro parties including the National Front in France, Britain's UKIP, Syriza in Greece and the Dutch Freedom Party could capture 20 percent or more of the seats.     That could pressure the EU's main party groups to tack right and challenge Europe's ability to integrate further given new powers the parliament will have to rule on the majority of EU legislation.     It could pull mainstream parties into more eurosceptic positions and complicate both the appointment of a new European Commission (due later in the year) and the task of passing banking union-related legislation, said Alastair Newton, senior political analyst at Nomura Securities.          BANK STRESS     That the EU has fallen short of its initial plans for a banking union to prevent future financial crises is plain.     For several years at least, the buck for a failing bank will ultimately stop with national governments, leaving the  doom loop ensnaring weak banks and indebted sovereigns unbroken.     The ECB will publish health tests of Europe's biggest banks prior to taking over their supervision in November.     The scope for a major shock is limited given the extent to which banks have already recapitalised. Still, lending is likely to remain constrained until the tests are complete - hampering economic recovery - and the structure of banking union as it now exists could allow a future crisis to blow up.      GERMAN COURT     The main reason to be cheerful about the euro zone is the markets' unwillingness to test the ECB's safety net. Any hole in that would change the terms of the game at a stroke.     Germany's Constitutional Court will rule soon on the ECB's bond-buying programme, its as yet unused mechanism to protect the euro zone.     The history of the Karlsruhe-based court has not been to reject outright any crisis-fighting measures though it has bestowed greater levels of scrutiny upon Germany's Bundestag.     But if it did take the nuclear option, the bond market could declare open season on the currency bloc's weaker members once more, pushing it back into crisis.          REFORM ZEAL     The ECB has consistently said it is buying time for  countries to put their houses in order by curbing debts and enacting economic reforms needed to thrive in the 21st century.     The main flashpoints are Italy, which has stagnated for a decade and has a coalition government which may lack the cohesion to respond, and France which is teetering on the edge of a new recession.     France remains the only major European economy which is beset by serious health problems and has not yet done much about it, Berenberg Bank said in its annual review of the euro zone.     President Francois Hollande used his New Year address to offer companies lower labour taxes if they hire more workers. But with his popularity levels at record lows, a radical leap is unlikely.     Austerity fatigue is most potent in Greece, the country that sparked the debt crisis.     Its coalition government refuses to countenance more cuts and will need some form of debt relief to put its finances on a sustainable path at a time when its parliamentary majority is down to just three seats and the anti-bailout Syriza opposition  is ascendant in the polls.          DEFLATION     If deflation took hold - a big if - that would pose the direst threat of all, raising the prospect of a Japan-style lost decade and making national debts even harder to pay off.     A plunge in euro zone inflation to just 0.7 percent prompted the ECB to cut interest rates in November but many of its members are viscerally opposed to the sort of money printing that finally breathed life into Japan's economy.     We must take care that we don't have inflation stuck permanently below 1 percent and thereby slip into the danger zone, ECB chief Mario Draghi said last week.     Even without deflation, any slippage in debt-cutting and structural reforms may require further action from the ECB.     The history of the euro zone crisis shows that while policymakers lose their sense of urgency when the pressure diminishes, they rush to bolster their defences when the heat comes on and have consistently done so just in time.     2014 stands to be more challenging and dangerous for euro zone financial markets than the surprisingly calm 2013, said     Russell Jones, economist at Llewellyn Consulting in London.     (But) predictions of the euro area's imminent demise have proved systematically wide of the mark.   (Editing by Susan Fenton)  ((email: mike.peacock@thomsonreuters.com)(Reuters Messaging:)(mike.peacock.thomsonreuters.com@reuters.net: +44 207 542 3784))  Keywords: EUROZONE ECONOMY/",20140106060500nL6N0K9244,nL6N0K9244
84,63851,,en,US POL TAX FED FBOX NEWS1 GVD IMM RTM DEF HECA LINS IR GUNCTR JUDIC CLJ JOB WASH LAW DBT FINS INSR BACT EMRG ASIA MEAST AMERS GEN SOCI CTXT PIA CIV CEN LEN RTRS,G C D E M O T U MTL GRO SOF OIL MNI NAT ELN NAW PSC,RTRS,01/05/2014 19:26:55,01/05/2014 19:26:55,FACTBOX: Key issues that will help define U.S. Congress in 2014,"The U.S. Congress begins its legislative year on Monday with an emphasis on economic and fiscal affairs, including legislation to fund the government beyond Jan. 15 and the likely confirmation of Janet Yellen as the first woman to head the Federal Reserve.     Plenty of other issues also will compete for attention. But with members of Congress jockeying for position in advance of the November elections, it will be difficult for them to avoid the partisanship that marked last year's session and find common ground to do much of anything in the new year. [ID:L2N0KD0DE]     As a result, the Democrat-controlled Senate and Republican-controlled House of Representatives may be hard-pressed to do much beyond funding the government and raising the U.S. debt ceiling.     Here are the top issues facing Congress this year:                            YELLEN NOMINATION     Just hours after the Senate begins its work on Monday, it is expected to confirm Janet Yellen as the first woman chair of the Federal Reserve. As vice chair since 2010, Yellen has been an unwavering advocate of the central bank's aggressive steps to boost the U.S. economy. She will succeed Ben Bernanke, whose term comes to a close at the end of the month.          JOBLESS BENEFITS     Senate Democrats also kick off a bid on Monday to restore long-term jobless benefits for 1.3 million Americans. The benefits expired on Dec. 28 after efforts came up short to include them in a bipartisan, end-of-year budget deal. [ID:nL2N0KD0DE]     Many Republicans oppose an extension, arguing it would be a disincentive to find work. Democrats say relief is a moral imperative and would boost spending cuts elsewhere to help cover the cost.           GOVERNMENT FUNDING     Congress faces a Jan. 15 deadline to pass a massive appropriations bill to keep federal agencies operating. It is expected to do so largely because failure would set the stage for something neither party wants: a government shutdown.     The bipartisan budget deal enacted last month set overall spending levels for the rest of this fiscal year, which ends on Sept. 30, as well for the following year.     House and Senate aides are working to divide up $1.012 trillion for the current fiscal year, which will ease automatic across-the-board spending cuts.           DEBT CEILING     House Republicans and Senate Democrats are headed for another fight over the U.S. debt limit. President Barack Obama and his fellow Democrats insist that the borrowing cap must be increased without new conditions being attached. Republicans have warned that they will be looking for something in return for adding to the $17.2 trillion national debt.     But there appears to be little appetite for going to the brink of a historic government default when Treasury Department borrowing authority runs out, possibly in early March.          MINIMUM WAGE     Democrats seem certain to fail in yet another major initiative - this one to increase the federal minimum wage. But they are expected to use the issue to rally their core supporters on election day. Polls show most Americans favor an increase in the minimum wage, which has stood at $7.25 an hour since July 2009.     Democrats say an increase is needed to help curb the growing gap between rich and poor. Republicans oppose an increase, saying it would cost jobs. A White House-backed bill would increase the minimum wage to $10.10 an hour over three years and index it to inflation in the future.          IMMIGRATION     House Speaker John Boehner says he remains committed to revamping the nation's immigration laws, but whether he and his fellow Republicans will find enough support is unclear.     Boehner rejects the bipartisan comprehensive bill passed by the Senate last year and instead favors a step-by-step approach.     The biggest stumbling block appears to be the pathway to citizenship sought by the Senate for an estimated 11 million undocumented immigrants living in the United States. House Republicans call the pathway amnesty for lawbreakers.             TAX BREAKS     Almost 60 U.S. tax code provisions expired on Dec. 31. Known collectively as tax extenders, they include business tax breaks such as the research-and-development credit and bonus depreciation, as well as items for individuals, such as a deduction for qualified college tuition.     Senate Democratic Leader Harry Reid has introduced legislation to renew these tax breaks, but it has a long way to go through the legislative process.      MILITARY PENSIONS     Although Congress overwhelmingly approved a two-year budget deal, members of both parties want to revise a provision that would achieve $6 billion in savings over 10 years by trimming pension benefits for working-age military retirees.     Starting in 2015, these retirees under age 62 will see slightly lower cost-of-living adjustments and some critics complain the change would even apply to disabled veterans - something that congressional negotiators did not intend. Expect disabled vets to end up avoiding a cut.         OBAMACARE    Republicans are certain to keep pushing to repeal Obama's namesake healthcare program. But the president says that Obamacare will remain the law - at least while he is in the White House, where he can veto any legislation to kill it.     Meanwhile, the fumbled kickoff of Obamacare has prompted many frustrated Democrats to call for action to bolster the program and ease voter opposition. Backers note that an estimated 2 million people have signed up for the insurance. Yet that is 1 million short of what had been forecast by the end of 2013.                 IRAN SANCTIONS     Senate Democratic Leader Reid may defy a White House veto threat and call for a vote to impose new sanctions on Iran if talks aimed at curbing Iran's nuclear program fail. The Senate vote could come as early as this month. Obama says threatening to toughen sanctions would be counterproductive at a time when his administration is working to improve relations with Iran, which have been very tense for more than 35 years.             PLASTIC GUNS     In response to a proliferation of plastic guns made with 3-D printers, a group of Democratic lawmakers supports a White House-backed push to update a 25-year-old law against guns that can pass undetected through metal detectors.     These members want all firearms to include at least a few ounces of non-removable metal that are essential to firing the weapon. The gun industry opposes such proposals, saying it would infringe on the right to bear arms.              DC CIRCUIT COURT OF APPEALS     U.S. District Court Judge Robert Wilkins appears certain to be confirmed by the Senate to a seat on the U.S. Circuit Court of Appeals for the District of Columbia, which is widely considered the nation's second most powerful court, behind only the U.S. Supreme Court. A vote is likely early this month.     Wilkins will be Obama's third nominee to the D.C. Circuit to be confirmed by the Senate within three months. All three were blocked last year, helping trigger a Senate rule change that stripped Republicans of their ability to stop most of Obama's nominees with a filibuster.   (Reporting by Thomas Ferraro; Editing by Jim Loney and Steve Orlofsky)  ((Thomas.ferraro@thomsonreuters.com)(202)(898-8391)(cell)(410)( 212-6190)(Reuters Messaging:)(thomas.ferraro.thomsonreuters.com@reuters.net))  Keywords: USA CONGRESS/FACTBOX",20140105192655nL2N0JZ1ZD,nL2N0JZ1ZD
